{
  "title": "Captain Giggle and the Crocodile Who Needed a Friend",
  "version": 1,
  "ageRange": "6–10",
  "duration": 600,
  "frame": {
    "width": 1920,
    "height": 1080,
    "aspect": "16:9",
    "fps": 24
  },
  "status": "Approved 10-minute script and illustrated planning preview. Full character-performance animation and recorded audio remain unrendered.",
  "characters": [
    {
      "id": "giggle",
      "name": "Leo",
      "look": "Existing DLL Studio orange Spinosaurus superhero. Long orange snout, teal eyes, cream jaw, spectacular blue sail with orange ribs, blue armored suit with orange trim, silver wrist guards, lightning chest emblem, tool belt and clawed feet. Use public/characters/leo.png as the authoritative identity reference. Captain Giggle is his adventure role; never replace him with a human.",
      "scale": "1.0 unit",
      "voice": "Warm mid-range voice, buoyant and sincere; let terrible jokes land in a small silence.",
      "trait": "Brave, optimistic, clumsy and kind. Laughter is an invitation, never mind control; he listens before joking about a sad feeling."
    },
    {
      "id": "zip",
      "name": "Zip",
      "look": "Small russet squirrel; cream muzzle, single large curled tail; orange goggles with clear lenses and brown tool belt. Always four limbs, two ears, one tail.",
      "scale": "0.45 unit",
      "voice": "Quick, crisp and logical, but slow down for instructions.",
      "trait": "Inventive, energetic; owns mistakes. Gadgets work through visibly impossible cartoon mechanisms, not reproducible construction instructions."
    },
    {
      "id": "luna",
      "name": "Luna",
      "look": "Young human inventor; medium-brown skin, dark wavy bob; purple jacket, teal backpack, glowing star-shaped badge, teal trousers and white shoes.",
      "scale": "0.8 unit",
      "voice": "Calm, clear, curious. A short pause before observations.",
      "trait": "Observant and creative. Her soft holograms guide and illuminate; never point beams into eyes."
    },
    {
      "id": "boomer",
      "name": "Boomer",
      "look": "Oversized rounded robot dog; cream shell, teal ear panels and paws, blue oval eyes on a charcoal face screen, yellow chest light. Four short legs; no sharp hardware.",
      "scale": "0.75 unit at shoulder",
      "voice": "Friendly rounded voice with occasional gentle electronic chirps; dialogue always understandable.",
      "trait": "Loyal and snack-distracted. Protective bubbles are obvious fantasy and remain near ground level."
    },
    {
      "id": "snapper",
      "name": "Snapper",
      "look": "Giant mint-green cartoon crocodile; pale lime belly, broad rounded muzzle, large gentle amber eyes, small rounded white teeth, four short legs, one broad flexible tail; oversized bright yellow floppy hat with teal band.",
      "scale": "2.2 units high; 3.5 long",
      "voice": "Soft low voice; hesitant at first, warmer later. Never a roar.",
      "trait": "Lonely and misunderstood. Wants connection, apologizes for taking the cake and helps repair the harm. Kindness does not excuse taking things."
    }
  ],
  "scenes": [
    {
      "id": 1,
      "name": "A cupcake landing",
      "start": 0,
      "duration": 60,
      "location": "Bubbleville town square",
      "characters": [
        "giggle",
        "zip",
        "luna",
        "boomer"
      ],
      "beats": [
        {
          "action": "Wide: a cupcake cart rolls slowly along a level painted parade track. Leo jogs beside it; empty foam cushions fill a shallow display pit.",
          "dialogue": [
            {
              "speaker": "Narrator",
              "text": "In Bubbleville, even a cupcake can have a busy morning!"
            }
          ],
          "sfx": "Gentle cart rattle",
          "onScreen": "",
          "start": 0,
          "duration": 10
        },
        {
          "action": "Leo plants himself on an impossible squashy spring tile. It bends like jelly, then softly flips him sideways, below head height.",
          "dialogue": [
            {
              "speaker": "Leo",
              "text": "Stop, little cakes! I am excellent at stopping. Mostly."
            }
          ],
          "sfx": "Rubbery boing",
          "onScreen": "",
          "start": 10,
          "duration": 10
        },
        {
          "action": "He lands in the cushion display, parade ribbon spread safely behind him. Cupcakes bounce into Boomer’s open tray. Hold his embarrassed blink.",
          "dialogue": [
            {
              "speaker": "Leo",
              "text": "Why did the cupcake stop? It ran out of sprinkles!"
            }
          ],
          "sfx": "Soft poof; one tiny rim tap",
          "onScreen": "",
          "start": 20,
          "duration": 10
        },
        {
          "action": "Boomer stops the cart with a giant projected bubble. He sniffs one cupcake, then notices Luna watching and closes the tray.",
          "dialogue": [
            {
              "speaker": "Boomer",
              "text": "Delivery complete. Snack investigation… postponed."
            }
          ],
          "sfx": "Bubble plip",
          "onScreen": "",
          "start": 30,
          "duration": 10
        },
        {
          "action": "The crew joins Leo beside the stopped cart as festival bunting unfolds overhead. Introduce them through their work.",
          "dialogue": [
            {
              "speaker": "Narrator",
              "text": "Leo, Zip, Luna and Boomer are preparing Bubbleville’s Friendship Festival. One invitation is still in the basket."
            }
          ],
          "sfx": "Gentle original music and scene foley",
          "onScreen": "",
          "start": 40,
          "duration": 10
        },
        {
          "action": "Camera tilts down to three huge, rounded footprints pressed into soft festival confetti. A yellow hat tip appears behind a distant roof.",
          "dialogue": [
            {
              "speaker": "Narrator",
              "text": "But who left these enormous footprints?"
            }
          ],
          "sfx": "Three gentle low marimba notes",
          "onScreen": "",
          "start": 50,
          "duration": 10
        }
      ],
      "hook": "The uninvited guest",
      "interaction": null,
      "camera": "Establish geography in a wide shot, then eye-level two-shots and readable reaction close-ups. Keep screen direction consistent; use one gentle tracking move.",
      "motion": "Render real articulated character performance: weight shifts, steps, head/eye direction, hand or paw gestures, facial changes and interaction with props. Do not substitute still images, bobbing sprites, camera-only pans or repeated five-second loops. Wide: a cupcake cart rolls slowly along a level painted parade track. Leo jogs beside it; empty foam cushions fill a shallow display pit. Leo plants himself on an impossible squashy spring tile. It bends like jelly, then softly flips him sideways, below head height. He lands in the cushion display, parade ribbon spread safely behind him. Cupcakes bounce into Boomer’s open tray. Hold his embarrassed blink. Boomer stops the cart with a giant projected bubble. He sniffs one cupcake, then notices Luna watching and closes the tray. The crew joins Leo beside the stopped cart as festival bunting unfolds overhead. Introduce them through their work. Camera tilts down to three huge, rounded footprints pressed into soft festival confetti. A yellow hat tip appears behind a distant roof.",
      "lighting": "Sky blue, sunflower yellow, coral and fresh mint; soft sunny daylight",
      "music": "Original gentle scene score; preserve musical continuity across production joins and duck beneath dialogue.",
      "visualPrompt": "High-quality colorful 3D children’s animation, Leo the established DLL Studio Spinosaurus and Zip, Luna, Boomer in Bubbleville town square. Wide: a cupcake cart rolls slowly along a level painted parade track. Leo jogs beside it; empty foam cushions fill a shallow display pit. Preserve approved character designs, natural expressive acting, soft bright light, no logos or generated lettering, 16:9 widescreen. Use Leo’s approved artwork, never a substitute human hero.",
      "consistency": [
        {
          "id": "giggle",
          "name": "Leo",
          "look": "Existing DLL Studio orange Spinosaurus superhero. Long orange snout, teal eyes, cream jaw, spectacular blue sail with orange ribs, blue armored suit with orange trim, silver wrist guards, lightning chest emblem, tool belt and clawed feet. Use public/characters/leo.png as the authoritative identity reference. Captain Giggle is his adventure role; never replace him with a human.",
          "scale": "1.0 unit",
          "voice": "Warm mid-range voice, buoyant and sincere; let terrible jokes land in a small silence.",
          "trait": "Brave, optimistic, clumsy and kind. Laughter is an invitation, never mind control; he listens before joking about a sad feeling."
        },
        {
          "id": "zip",
          "name": "Zip",
          "look": "Small russet squirrel; cream muzzle, single large curled tail; orange goggles with clear lenses and brown tool belt. Always four limbs, two ears, one tail.",
          "scale": "0.45 unit",
          "voice": "Quick, crisp and logical, but slow down for instructions.",
          "trait": "Inventive, energetic; owns mistakes. Gadgets work through visibly impossible cartoon mechanisms, not reproducible construction instructions."
        },
        {
          "id": "luna",
          "name": "Luna",
          "look": "Young human inventor; medium-brown skin, dark wavy bob; purple jacket, teal backpack, glowing star-shaped badge, teal trousers and white shoes.",
          "scale": "0.8 unit",
          "voice": "Calm, clear, curious. A short pause before observations.",